게시날짜,제목,조회수,좋아요수,댓글수,연관키워드,영상내용요약,VideoID
2021-12-14,기념일 데이트ㅣ스테이크 맛집 추천ㅣ밴건디 스테이크 하우스,1135,12,13,"오래된커플, 레스토랑, 가로수길, 코스요리, 존맛, 파스타, 고기, 데이트",7주년 기념으로 서래마을에 있는 스테이크 맛집 밴건디 스테이크 하우스에 다녀왔습니다.,-zYNAIu5Hqg
2025-09-08,하얏트서울 스테이크 하우스 디너세트 먹고 왔어요~기념일이라면 레터링서비스 신청☝🏻 (분위기도 좋고 구성도 좋아 추천해요!),1100,9,2,,호텔 스테이크전문점 하얏트 스테이크 하우스서 생일 밥 먹고 온 브이로그 #스테이크하우스 #호텔디너 #하얏트서울디너,7KlrOMXriu0
2024-10-25,한양한정식 페스티벌 #전라남도맛집 #축제 근사하다 모든 잔치 모임 기념일 행사 예약하라 ☎️ 전화:050-71478-8225 구독과좋아요 늘 감사합니다,1072,0,0,,,Rtg89K7n398
2025-03-17,한끼 24만원 이돈주고 먹을래..? 🔥 #기념일 #워커힐디너,955,0,4,"워커힐, 워커힐디너, 워커힐런치, 워커힐뷔페, 워커힐모에기, 모에기디너, 모에기런치, 데이트코스, 기념일코스, seoul, korea",비스타워커힐호텔 모에기 테판 디너 할인 +워커힐 멤버쉽 추천,NKg8XM2EFXU
2020-09-03,[VLOG] 청담 맛집 / 미슐랭 플레이트 프렌치 레스토랑 '비스트로 드 욘트빌' / 기념일 레스토랑으로 완전 추천 / 분위기 내고온 기념일 브이로그 / 갤럭시 Z플립 브이로그,908,4,0,"브이로그, 청담맛집, 미슐랭플레이트, 프렌치레스토랑, 비스트로드욘트빌, VLOG, 일상브이로그, 기념일, 기념일레스토랑",안녕하세요 ^^ 결혼기념일에 다녀왔던 프렌치 레스토랑이 너무 기억에 좋아서 브이로그로 따로 올리게 되었어요!,nYH36Wpdf78
2025-07-10,"예약 전쟁이 벌어지는 식당, 윤남노의 디핀 리뷰 - 기념일에 가기 좋은 식당 추천 / 윤남노 셰프 디핀 예약 꿀팁",810,1,0,,서울 신당과 옥수에 자리한 ‘디핀(Deepin)’은 윤남노 셰프가 운영하는 미식 공간입니다.,acrM0KdmcGI
2025-03-04,2025.2.28 웨스틴조선호텔 뷔페 아리아 aria 평일디너 고객감사특별가 행사중 호텔뷔페추천 기념일런치디너 #서울맛집 #서울뷔페 #기념일데이트 #호텔뷔페 #대게   #랍스터,772,4,0,,,Sm-WNCN5VFE
2022-10-22,서울 강남 뷔페 | 텍사스 데 브라질 | 네이버예약 | 평일 디너 | 기념일 맛집,750,7,0,,#압구정 #강남뷔페 #강남맛집 #강남가볼만한곳 #서울뷔페 #뷔페 #고기뷔페 #고기맛집 #안다즈호텔 #기념일 #레스토랑 #강남뷔페,yJ5CLePwm8E
2023-08-11,석촌호수 맛집 기념일에 가고싶은 프랑스와 리뷰,690,27,25,,안녕하세요? 작호의리뷰입니다. 블로그를 하고 싶었던 이유,uymut-78mO4
2025-03-04,기념일 당일에 깜빡하신분들 주목! #대구맛집,650,3,0,,바쁜 하루하루에 기념일 깜빡하신적 있지 않으세요?! 레터링케잌 같은 종류는 며칠전부터 예약을 해야하기 때문에,nahZWRFzZRI
2025-06-26,장모님이 예약해주는 가족식사모임 #기념일 #맛집 #예약 #시니어정보 #키오스크 #모바일예약 #노인정보 #65세이상 @모두의아들tv,613,0,0,"#어르신정보, 시니어라이프, 건강관리, 복지혜택, 연금정보, 스마트폰활용법, 정부지원, 병원예약, 금융기초, 스마트기기교육, 실버일자리, 노후준비, 치매예방, 행복한노후, 세금절약, 일상안전, 문화생활, 실용정보, 간단운동, ATM이용법, 관절건강, 은행예약",더 이상 음식점 예약 어렵지 않아요! 방에서 손가락으로 슥슥 하면 끝!,N4IYjWMJduA
2025-09-23,기념일에 예약하면 무조건 성공#맛집털보,558,3,0,,합정에 위치한 빠넬로 입니다🧔🏻‍♂️ 생면 파스타와 피자가 끝내주는 곳으로,Qy9NL8z79eA
2025-01-26,게찜 #대게 #홍게 #기념일 저녁식사 #예약,549,7,0,,,JVtbfcy8Eqg
2025-05-11,남편이 결혼기념일 1주년을 맞이하여 인계동 등심 코스요리 예약했어요 🥩 ❤️#기념일데이트 #한우등심 #코스요리,540,2,0,"수원, 인계동, 한우, 등심, 이벤트, 결혼기념일, 기념일, 인계동맛집, 대파라면, 한우볶음, 쑥아이스크림, 인계동데이트, 20대, 30대","수원 인계동 등심 코스요리, 우와인에 다녀왔어요 ~ !",1siquYYVdlI
2024-10-25,한양한정식 페스티벌 #전라남도맛집 #축제 근사하다 모든 잔치 모임 기념일 행사 예약하라 ☎️ 전화:050-71478-8225 구독과좋아요 늘 감사합니다 6,519,0,0,,,yhYEaalBUvU
2025-04-20,김해 진영 한우 오마카세! 특별한 기념일을 위한 완벽한 선택 🍖🎉,505,3,0,"먹방, 맛집브이로그, 일상, 여행","기념일에 딱 맞는 한우 오마카세, 김해 진영의 ‘오늘 한우’! 1시간에 1팀만 예약받는 프라이빗한 공간에서, 1++ 한우로 만든 다양한 코스 요리를 경험해보세요. 맛있는 고기...",SIkPH9ETOA8
2024-10-25,한양한정식 페스티벌 #전라남도맛집 #축제 근사하다 모든 잔치 모임 기념일 행사 예약하라 ☎️ 전화:050-71478-8225 구독과좋아요 늘 감사합니다 9,503,0,0,,,OPZb0gPbY5Q
2025-06-08,"서울 한우 오마카세 맛집 광화문 주변 신상 룸식당 생일 기념일 데이트 예약, 대보정 서울시청역점 #협찬 #서울한우오마카세맛집  #광화문룸식당 #광화문한우 #대보정 #초록생각",486,2,0,,,oQeABT69MfI
2024-10-25,한양한정식 페스티벌 #전라남도맛집 #축제 근사하다 모든 잔치 모임 기념일 행사 예약하라 ☎️ 전화:050-71478-8225 구독과좋아요 늘 감사합니다 6,484,0,0,,,z0On5p4I2ko
2024-03-20,#쇼츠 #해운대 #맛집 #베이징덕 #예약 #가족 #기념일 #생일 #날씨맑음 #겉바속촉,471,7,0,,,fcneXLib_OA
2024-10-25,한양한정식 페스티벌 #전라남도맛집 #축제 근사하다 모든 잔치 모임 기념일 행사 예약하라 ☎️ 전화:050-71478-8225 구독과좋아요 늘 감사합니다 4,470,0,0,,,RbUGA7DHL_Q
2024-06-05,"45,000원에 코스요리를 먹을 수 있는 기념일 식당 - 서교동 원스(Won's)",470,9,0,"데이트코스, 맛집","1,000일 기념으로 서교동에 있는 다이닝 음식점 ""원스(Won's)""에 다녀왔습니다!",cxowPfSv-w0
2024-01-03,완벽한 기념일 프리패스 치트키! 울프강 예약 필요없는 완벽한 스테이크! #shorts,462,3,1,"홈파티, 레시피, 요리, 간단요리, 연말메뉴, 비쥬얼, 와인안주, 와인, 위스키, 술안주, JMT, 홈파티메뉴, 스테이크, 토마호크, 기념일, 와이프, 울프강, 아웃백, 피터루거, wolfgang, peterluger, steak, steakhouse, 스테이크하우스, 고든램지, 더마고그릴, 붓처스컷, 저스트스테이크",2024년 새해가 밝았습니다🌞🐲 올해도 좋은 일만,A5WGrTGfPoc
2025-10-01,콘서트가 있는 3만원대 코스 요리 #기념일레스토랑 #광진구맛집 #군자역맛집,450,2,1,,"점심에도 특별한 시간을 원하시나요? 라뮤즈 런치 콘서트 (1인 39,000원~) 🎶",Geuefth1kaY
2025-08-06,아서원1920 전주본점_네이버예약시 육즙군만두 무료 #가족식사 #맛집 #기념일 #넷플릭스맛집 #전주중국집 #이색맛집 #이색데이트 #전주맛집 #송천동맛집,411,1,0,,,rurCmt3_XVQ
2025-08-25,도쿄 야키니쿠 맛집 시부야 맛집 이케부쿠로 야끼니꾸 니쿠아자부 기념일,349,9,0,,도쿄여행 필수맛집 와규케이크도 서비스해주고,0vPAU8QO1x8
2024-06-14,"결혼기념일 핑계고 도쿄 미슐랭 원스타 오마카세 Ep02🇯🇵 | 디즈니씨 DPA 없이 즐기기, 몬자야끼 맛집 추천",322,6,0,"vlog, tokyo, 도쿄여행, 도쿄",결혼기념일을 핑계로 예약하기 어려운 도쿄 미슐랭 맛집부터 액티비티까지,Tqf0DdUrLRs
2025-12-20,잠실 케이크 예약 크리스마스_레터링 당일 기념일 쏘스윗 잠실점 #잠실맛집 #크리스마스케이크,300,0,0,,,GTzZoXAbUC4
2025-02-10,발렌타인데이 기념일데이트 장소 예약하셨어요? #마코토 #강남데이트 #압구정데이트 #청담맛집 #서울맛집추천 #데이트코스추천 #압구정데이트 #서울기념일데이트 #이색데이트 #청담소개팅,283,1,0,,,oSvENkWwS6k
2023-10-06,여자친구랑 기념일인데 유명한 맛집 예약 성공 할 수 있을까? (맛집예약) #shorts,278,1,0,"캐치테이블, 맛집예약, 캐치테이블예약팁, 연돈예약하기, 캐치테이블예약방법, 캐치테이블등록, 캐치테이블사용법, 캐치테이블맛집, 맛집탐방, 맛집소개, 맛집추천, 맛집투어, 맛집리뷰, 맛집, 꿀팁, 일상생활, 생활꿀팁, shorts, 효성CMS, CMS, FCMS",생활·금융·경제·상식 정보 전달자! 생활플랫폼 - 정보다이쏘!,PdDlcrJQozk
2026-01-08,부천 나리스키친 솔직 후기 | 기념일데이트추천 #부천맛집 #부천 #데이트 #기념일,258,0,2,"부천맛집, 나리스키친, 부천데이트, 부천레스토랑, 토마호크, 토마호크스테이크, 스테이크, 파스타, 까르보나라, 양식맛집, 파스타맛집, 기념일데이트, 결혼기념일, 겨울데이트, 실내데이트, 맛집추천, 경기도맛집, 데이트코스",부천 분위기 맛집 나리스키친🧡 소품 하나까지 디테일 가득한 공간,2Th9tg992dU
2025-03-25,캐나다 국제커플 4주년! 기념일! 디너데이트 ❤ 토론토 욕빌 레스토랑 추천 alo bar 토론토 레스토랑 먹방 브이로그벌써 4주년이라니..!!😮,216,9,9,,캐나다 국제커플 4주년! 기념일! 디너데이트 ❤ 토론토 욕빌 레스토랑 추천 alo bar 토론토 레스토랑 먹방 브이로그,sUeZ14pYAoE
2025-02-07,기념일 맛집ෆ 서울 top5 핫플 강민철레스토랑 디너예약만 한달? #서울맛집#기념일맛집#서울데이트#서울미슐랭맛집#미쉐린맛집#서울핫플#강민철레스토랑,215,2,1,,,1TmuPIlCl8Y
2025-10-24,건대에서 이런 소고기 요리라니! 라뮤즈 뵈프 부르기뇽#기념일레스토랑 #맛집#shorts,214,1,2,,"쉽게 맛볼 수 없는 프랑스식 소고기 요리, 뵈프 부르기뇽!",aE5gXuol7WE
2024-01-25,💐기념일 레스토랑 #부천맛집 #스페인음식점 #빠에야,156,0,0,"빠에야, 스페인먹킷리스트, 기념일맛집, 데이트장소추천, 스페인음식점",🔸빠에야 2인 세트     [사전예약메뉴] •아란치니(2pcs),B_aVvb0hAyc
